{
  "$schema": "https://json-schema.org/draft/2020-12/schema",
  "$id": "https://github.com/SoBatista/VulnDockyard/raw/main/src/vulndockyard/data/schemas/manifest-v1.schema.json",
  "title": "VulnDockyard reviewed lab manifest v1",
  "type": "object",
  "additionalProperties": false,
  "required": [
    "schema_version",
    "id",
    "display_name",
    "description",
    "categories",
    "runtime_backend",
    "upstream",
    "version",
    "license",
    "trust",
    "images",
    "services",
    "friendly_hostname",
    "health_check",
    "initialization",
    "reset",
    "default_credentials",
    "resources",
    "ephemeral_storage",
    "persistence",
    "outbound_network",
    "dangerous_capabilities",
    "expected_functionality",
    "known_limitations",
    "last_verified",
    "adapter_status",
    "verification",
    "taxonomy",
    "references"
  ],
  "$defs": {
    "strings": {
      "type": "array",
      "items": {
        "type": "string",
        "minLength": 1
      }
    },
    "httpsStrings": {
      "type": "array",
      "items": {
        "type": "string",
        "format": "uri",
        "pattern": "^https://[^/?#]+"
      }
    },
    "platforms": {
      "type": "array",
      "items": {
        "enum": [
          "linux/amd64",
          "linux/arm64",
          "linux/arm/v7"
        ]
      },
      "uniqueItems": true
    },
    "image": {
      "type": "object",
      "additionalProperties": false,
      "required": [
        "name",
        "digest",
        "architectures",
        "role"
      ],
      "properties": {
        "name": {
          "type": "string",
          "minLength": 3,
          "maxLength": 255,
          "pattern": "^(?:(?:[a-z0-9](?:[a-z0-9-]*[a-z0-9])?\\.)+[a-z0-9](?:[a-z0-9-]*[a-z0-9])?|localhost)(?::[1-9][0-9]{0,4})?/[a-z0-9]+(?:[._-][a-z0-9]+)*(?:/[a-z0-9]+(?:[._-][a-z0-9]+)*)*$"
        },
        "digest": {
          "type": "string",
          "pattern": "^(|sha256:[0-9a-f]{64})$"
        },
        "architectures": {
          "$ref": "#/$defs/platforms"
        },
        "role": {
          "type": "string",
          "minLength": 1
        }
      }
    },
    "service": {
      "type": "object",
      "additionalProperties": false,
      "required": [
        "name",
        "image_role",
        "internal_port",
        "protocol",
        "health_path",
        "identity_marker"
      ],
      "properties": {
        "name": {
          "type": "string",
          "minLength": 1
        },
        "image_role": {
          "type": "string",
          "minLength": 1
        },
        "internal_port": {
          "type": "integer",
          "minimum": 1,
          "maximum": 65535
        },
        "protocol": {
          "enum": [
            "http",
            "https",
            "tcp"
          ]
        },
        "health_path": {
          "type": "string",
          "maxLength": 512,
          "pattern": "^/(?!/)(?!.*#)"
        },
        "identity_marker": {
          "type": "string",
          "minLength": 1,
          "maxLength": 160,
          "pattern": "^[ -~]+$"
        }
      }
    },
    "ephemeralMount": {
      "type": "object",
      "additionalProperties": false,
      "required": [
        "name",
        "container_path",
        "size_mb"
      ],
      "properties": {
        "name": {
          "type": "string",
          "pattern": "^[a-z][a-z0-9-]{0,62}$"
        },
        "container_path": {
          "type": "string",
          "minLength": 2,
          "maxLength": 4096,
          "pattern": "^/(?!/)(?!.*(?:^|/)\\.{1,2}(?:/|$))(?!.*[,\\\\])(?!.*/$)[ -~]+$"
        },
        "size_mb": {
          "type": "integer",
          "minimum": 1,
          "maximum": 4096
        }
      }
    }
  },
  "properties": {
    "schema_version": {
      "const": 1
    },
    "id": {
      "type": "string",
      "pattern": "^[a-z][a-z0-9-]{1,62}$"
    },
    "display_name": {
      "type": "string",
      "minLength": 1
    },
    "description": {
      "type": "string",
      "minLength": 1
    },
    "categories": {
      "$ref": "#/$defs/strings"
    },
    "runtime_backend": {
      "const": "docker-engine"
    },
    "upstream": {
      "type": "object",
      "additionalProperties": false,
      "required": [
        "repository",
        "homepage"
      ],
      "properties": {
        "repository": {
          "type": "string",
          "format": "uri",
          "pattern": "^https://[^/?#]+"
        },
        "homepage": {
          "type": "string",
          "format": "uri",
          "pattern": "^https://[^/?#]+"
        }
      }
    },
    "version": {
      "type": "object",
      "additionalProperties": false,
      "required": [
        "release",
        "tag",
        "commit"
      ],
      "properties": {
        "release": {
          "type": "string",
          "minLength": 1
        },
        "tag": {
          "type": "string",
          "minLength": 1
        },
        "commit": {
          "type": "string",
          "pattern": "^(|[0-9a-f]{40})$"
        }
      }
    },
    "license": {
      "type": "object",
      "additionalProperties": false,
      "required": [
        "spdx",
        "evidence_url",
        "redistribution"
      ],
      "properties": {
        "spdx": {
          "type": "string",
          "minLength": 1
        },
        "evidence_url": {
          "type": "string",
          "format": "uri",
          "pattern": "^https://[^/?#]+"
        },
        "redistribution": {
          "type": "string",
          "minLength": 1
        }
      }
    },
    "trust": {
      "type": "object",
      "additionalProperties": false,
      "required": [
        "level",
        "evidence",
        "limitations",
        "status_reason"
      ],
      "properties": {
        "level": {
          "enum": [
            "upstream-signed",
            "upstream-pinned",
            "vulndockyard-built",
            "quarantined"
          ]
        },
        "evidence": {
          "$ref": "#/$defs/httpsStrings"
        },
        "limitations": {
          "$ref": "#/$defs/strings"
        },
        "status_reason": {
          "type": "string",
          "minLength": 1
        }
      }
    },
    "images": {
      "type": "array",
      "items": {
        "$ref": "#/$defs/image"
      }
    },
    "services": {
      "type": "array",
      "items": {
        "$ref": "#/$defs/service"
      }
    },
    "friendly_hostname": {
      "type": "string",
      "pattern": "^[a-z][a-z0-9-]{0,61}\\.test$"
    },
    "health_check": {
      "type": "object",
      "additionalProperties": false,
      "required": [
        "type",
        "checks",
        "timeout_seconds"
      ],
      "properties": {
        "type": {
          "type": "string",
          "minLength": 1
        },
        "checks": {
          "$ref": "#/$defs/strings"
        },
        "timeout_seconds": {
          "type": "integer",
          "minimum": 1,
          "maximum": 900
        }
      }
    },
    "initialization": {
      "type": "object",
      "additionalProperties": false,
      "required": [
        "automatic",
        "steps"
      ],
      "properties": {
        "automatic": {
          "type": "boolean"
        },
        "steps": {
          "$ref": "#/$defs/strings"
        }
      }
    },
    "reset": {
      "type": "object",
      "additionalProperties": false,
      "required": [
        "strategy",
        "effects"
      ],
      "properties": {
        "strategy": {
          "type": "string",
          "minLength": 1
        },
        "effects": {
          "$ref": "#/$defs/strings"
        }
      }
    },
    "default_credentials": {
      "$ref": "#/$defs/strings"
    },
    "resources": {
      "type": "object",
      "additionalProperties": false,
      "required": [
        "memory_mb",
        "cpus",
        "pids",
        "read_only_root"
      ],
      "properties": {
        "memory_mb": {
          "type": "integer",
          "minimum": 128,
          "maximum": 16384
        },
        "cpus": {
          "type": "number",
          "minimum": 0.1,
          "maximum": 8
        },
        "pids": {
          "type": "integer",
          "minimum": 16,
          "maximum": 4096
        },
        "read_only_root": {
          "type": "boolean"
        }
      }
    },
    "ephemeral_storage": {
      "type": "object",
      "additionalProperties": false,
      "required": [
        "uid",
        "gid",
        "seeded",
        "empty"
      ],
      "properties": {
        "uid": {
          "type": "integer",
          "minimum": 0,
          "maximum": 65535
        },
        "gid": {
          "type": "integer",
          "minimum": 0,
          "maximum": 65535
        },
        "seeded": {
          "type": "array",
          "maxItems": 32,
          "items": {
            "$ref": "#/$defs/ephemeralMount"
          }
        },
        "empty": {
          "type": "array",
          "maxItems": 32,
          "items": {
            "$ref": "#/$defs/ephemeralMount"
          }
        }
      }
    },
    "persistence": {
      "type": "object",
      "additionalProperties": false,
      "required": [
        "required",
        "volumes"
      ],
      "properties": {
        "required": {
          "type": "boolean"
        },
        "volumes": {
          "allOf": [
            {
              "$ref": "#/$defs/strings"
            }
          ],
          "uniqueItems": true
        }
      }
    },
    "outbound_network": {
      "type": "object",
      "additionalProperties": false,
      "required": [
        "required",
        "reason",
        "challenge_dependencies"
      ],
      "properties": {
        "required": {
          "type": "boolean"
        },
        "reason": {
          "type": "string",
          "minLength": 1
        },
        "challenge_dependencies": {
          "$ref": "#/$defs/strings"
        }
      }
    },
    "dangerous_capabilities": {
      "$ref": "#/$defs/strings"
    },
    "expected_functionality": {
      "$ref": "#/$defs/strings"
    },
    "known_limitations": {
      "$ref": "#/$defs/strings"
    },
    "last_verified": {
      "type": "string",
      "format": "date",
      "pattern": "^[0-9]{4}-[0-9]{2}-[0-9]{2}$"
    },
    "adapter_status": {
      "enum": [
        "runnable",
        "quarantined",
        "unavailable"
      ]
    },
    "verification": {
      "type": "object",
      "additionalProperties": false,
      "required": [
        "status",
        "platforms",
        "evidence"
      ],
      "properties": {
        "status": {
          "enum": [
            "passed",
            "blocked"
          ]
        },
        "platforms": {
          "$ref": "#/$defs/platforms"
        },
        "evidence": {
          "$ref": "#/$defs/strings"
        }
      }
    },
    "taxonomy": {
      "type": "object",
      "additionalProperties": false,
      "required": [
        "owasp",
        "cwe",
        "cve"
      ],
      "properties": {
        "owasp": {
          "$ref": "#/$defs/strings"
        },
        "cwe": {
          "$ref": "#/$defs/strings"
        },
        "cve": {
          "$ref": "#/$defs/strings"
        }
      }
    },
    "references": {
      "$ref": "#/$defs/strings"
    }
  },
  "allOf": [
    {
      "if": {
        "properties": {
          "adapter_status": {
            "const": "runnable"
          }
        }
      },
      "then": {
        "properties": {
          "version": {
            "properties": {
              "tag": {
                "not": {
                  "pattern": "^[Ll][Aa][Tt][Ee][Ss][Tt]$"
                }
              },
              "commit": {
                "pattern": "^[0-9a-f]{40}$"
              }
            }
          },
          "trust": {
            "properties": {
              "level": {
                "enum": [
                  "upstream-signed",
                  "upstream-pinned",
                  "vulndockyard-built"
                ]
              },
              "evidence": {
                "minItems": 1
              }
            }
          },
          "images": {
            "minItems": 2,
            "maxItems": 2,
            "items": {
              "properties": {
                "digest": {
                  "pattern": "^sha256:[0-9a-f]{64}$"
                },
                "architectures": {
                  "minItems": 1
                }
              }
            },
            "allOf": [
              {
                "contains": {
                  "required": [
                    "role"
                  ],
                  "properties": {
                    "role": {
                      "const": "application"
                    }
                  }
                },
                "minContains": 1,
                "maxContains": 1
              },
              {
                "contains": {
                  "required": [
                    "role"
                  ],
                  "properties": {
                    "role": {
                      "const": "gateway"
                    }
                  }
                },
                "minContains": 1,
                "maxContains": 1
              }
            ]
          },
          "services": {
            "minItems": 1,
            "items": {
              "properties": {
                "image_role": {
                  "const": "application"
                },
                "protocol": {
                  "const": "http"
                }
              }
            }
          },
          "health_check": {
            "properties": {
              "type": {
                "const": "http-identity-and-functionality"
              }
            }
          },
          "initialization": {
            "properties": {
              "automatic": {
                "const": true
              }
            }
          },
          "verification": {
            "properties": {
              "status": {
                "const": "passed"
              },
              "platforms": {
                "minItems": 1
              },
              "evidence": {
                "minItems": 1
              }
            }
          },
          "resources": {
            "properties": {
              "read_only_root": {
                "const": true
              }
            }
          },
          "ephemeral_storage": {
            "properties": {
              "uid": {
                "minimum": 1
              },
              "gid": {
                "minimum": 1
              }
            }
          }
        }
      }
    },
    {
      "if": {
        "properties": {
          "adapter_status": {
            "enum": [
              "quarantined",
              "unavailable"
            ]
          }
        }
      },
      "then": {
        "properties": {
          "trust": {
            "properties": {
              "level": {
                "const": "quarantined"
              },
              "limitations": {
                "minItems": 1
              }
            }
          },
          "verification": {
            "properties": {
              "status": {
                "const": "blocked"
              }
            }
          }
        }
      }
    },
    {
      "if": {
        "properties": {
          "adapter_status": {
            "const": "runnable"
          },
          "trust": {
            "properties": {
              "level": {
                "const": "upstream-pinned"
              }
            }
          }
        }
      },
      "then": {
        "properties": {
          "trust": {
            "properties": {
              "limitations": {
                "minItems": 1
              }
            }
          }
        }
      }
    },
    {
      "if": {
        "properties": {
          "adapter_status": {
            "const": "runnable"
          },
          "persistence": {
            "properties": {
              "required": {
                "const": true
              }
            }
          }
        }
      },
      "then": {
        "properties": {
          "persistence": {
            "properties": {
              "volumes": {
                "minItems": 1
              }
            }
          }
        }
      }
    }
  ]
}
