{
  "schema_version": 1,
  "id": "dvwa",
  "display_name": "Damn Vulnerable Web Application",
  "description": "Classic PHP and MariaDB web vulnerability training application.",
  "categories": [
    "web",
    "php",
    "owasp"
  ],
  "runtime_backend": "docker-engine",
  "upstream": {
    "repository": "https://github.com/digininja/DVWA",
    "homepage": "https://github.com/digininja/DVWA"
  },
  "version": {
    "release": "209930b",
    "tag": "209930b",
    "commit": "209930b26ef16b1636dfac74ca49b5557fd0528e"
  },
  "license": {
    "spdx": "GPL-3.0-or-later",
    "evidence_url": "https://github.com/digininja/DVWA/blob/209930b26ef16b1636dfac74ca49b5557fd0528e/COPYING.txt",
    "redistribution": "Upstream image would be pulled; redistribution of modifications must satisfy GPL-3.0-or-later."
  },
  "trust": {
    "level": "quarantined",
    "evidence": [
      "https://github.com/digininja/DVWA/blob/209930b26ef16b1636dfac74ca49b5557fd0528e/.github/workflows/docker-image.yml"
    ],
    "limitations": [
      "Provenance, containment, licensing, architecture, or functionality review is incomplete."
    ],
    "status_reason": "The official application image is pinned, but the moving MariaDB dependency and setup/login/module smoke sequence have not been verified."
  },
  "images": [
    {
      "name": "ghcr.io/digininja/dvwa",
      "digest": "sha256:f332a2356b819df77fde5c5453b658ce222c82f909bdd35bc711019e0e89392c",
      "architectures": [
        "linux/amd64",
        "linux/arm64"
      ],
      "role": "application"
    },
    {
      "name": "docker.io/library/mariadb",
      "digest": "sha256:ce66c7be32a03aabe7241d0a10993a2db827ef652a35d25727d92a832ac8ef73",
      "architectures": [
        "linux/amd64",
        "linux/arm64"
      ],
      "role": "database"
    }
  ],
  "services": [
    {
      "name": "web",
      "image_role": "application",
      "internal_port": 80,
      "protocol": "http",
      "health_path": "/login.php",
      "identity_marker": "Damn Vulnerable Web Application"
    },
    {
      "name": "database",
      "image_role": "database",
      "internal_port": 3306,
      "protocol": "tcp",
      "health_path": "/",
      "identity_marker": "MariaDB"
    }
  ],
  "friendly_hostname": "dvwa.test",
  "health_check": {
    "type": "http-identity-and-functionality",
    "checks": [
      "Login identity present",
      "Database setup succeeds",
      "Default login and vulnerability navigation work"
    ],
    "timeout_seconds": 120
  },
  "initialization": {
    "automatic": false,
    "steps": [
      "Create or reset database through the setup page"
    ]
  },
  "reset": {
    "strategy": "Remove the owned database volume and recreate both services",
    "effects": [
      "database"
    ]
  },
  "default_credentials": [
    "admin / password"
  ],
  "resources": {
    "memory_mb": 768,
    "cpus": 1,
    "pids": 384,
    "read_only_root": false
  },
  "ephemeral_storage": {
    "uid": 0,
    "gid": 0,
    "seeded": [],
    "empty": []
  },
  "persistence": {
    "required": true,
    "volumes": [
      "database"
    ]
  },
  "outbound_network": {
    "required": false,
    "reason": "Core modules are local.",
    "challenge_dependencies": [
      "Insecure CAPTCHA needs Google reCAPTCHA keys",
      "Remote file inclusion may need a remote URL"
    ]
  },
  "dangerous_capabilities": [],
  "expected_functionality": [
    "Selectable security levels",
    "PHP vulnerability modules"
  ],
  "known_limitations": [
    "No formal upstream releases",
    "Official Compose database tag moves over time"
  ],
  "last_verified": "2026-09-06",
  "adapter_status": "quarantined",
  "verification": {
    "status": "blocked",
    "platforms": [],
    "evidence": []
  },
  "taxonomy": {
    "owasp": [
      "OWASP Top 10"
    ],
    "cwe": [],
    "cve": []
  },
  "references": [
    "https://github.com/digininja/DVWA"
  ]
}
