{
  "schema_version": 1,
  "id": "nodegoat",
  "display_name": "OWASP NodeGoat",
  "description": "Deliberately insecure Node.js application with accompanying tutorial.",
  "categories": [
    "web",
    "javascript",
    "owasp"
  ],
  "runtime_backend": "docker-engine",
  "upstream": {
    "repository": "https://github.com/OWASP/NodeGoat",
    "homepage": "https://owasp.org/www-project-node.js-goat/"
  },
  "version": {
    "release": "1.4",
    "tag": "v1.4",
    "commit": "9e35cae25f5c6226c30c7d9b03987005affb2888"
  },
  "license": {
    "spdx": "Apache-2.0",
    "evidence_url": "https://github.com/OWASP/NodeGoat/blob/v1.4/LICENSE",
    "redistribution": "A future project build is legally possible with Apache-2.0 notices, but none is authorized until its build review passes."
  },
  "trust": {
    "level": "quarantined",
    "evidence": [
      "https://github.com/OWASP/NodeGoat/blob/v1.4/docker-compose.yml",
      "https://github.com/OWASP/NodeGoat/blob/v1.4/Dockerfile"
    ],
    "limitations": [
      "Provenance, containment, licensing, architecture, or functionality review is incomplete."
    ],
    "status_reason": "No official upstream-published application image exists; v1.4 builds with Node 4.4 and Node 4 Alpine while Compose uses unresolved mongo:latest."
  },
  "images": [],
  "services": [
    {
      "name": "web",
      "image_role": "application",
      "internal_port": 4000,
      "protocol": "http",
      "health_path": "/",
      "identity_marker": "NodeGoat"
    },
    {
      "name": "database",
      "image_role": "database",
      "internal_port": 27017,
      "protocol": "tcp",
      "health_path": "/",
      "identity_marker": "MongoDB"
    }
  ],
  "friendly_hostname": "nodegoat.test",
  "health_check": {
    "type": "http-identity-and-functionality",
    "checks": [
      "RetireEasy login identity",
      "Tutorial and seeded accounts usable"
    ],
    "timeout_seconds": 120
  },
  "initialization": {
    "automatic": false,
    "steps": [
      "Run artifacts/db-reset.js against MongoDB"
    ]
  },
  "reset": {
    "strategy": "Recreate MongoDB and rerun the official reset script",
    "effects": []
  },
  "default_credentials": [
    "admin / Admin_123",
    "user1 / User1_123",
    "user2 / User2_123"
  ],
  "resources": {
    "memory_mb": 1024,
    "cpus": 1,
    "pids": 384,
    "read_only_root": false
  },
  "ephemeral_storage": {
    "uid": 0,
    "gid": 0,
    "seeded": [],
    "empty": []
  },
  "persistence": {
    "required": false,
    "volumes": []
  },
  "outbound_network": {
    "required": false,
    "reason": "Core lessons are local; the SSRF lesson requires an isolated fixture or explicitly acknowledged egress.",
    "challenge_dependencies": [
      "Tutorial embeds external video",
      "SSRF requires an isolated local fixture or explicit egress"
    ]
  },
  "dangerous_capabilities": [],
  "expected_functionality": [
    "RetireEasy application",
    "Node.js and OWASP Top 10 tutorial"
  ],
  "known_limitations": [
    "The v1.4 Dockerfile uses a Node 4.4 builder and Node 4 Alpine runtime",
    "The v1.4 Compose file uses unresolved mongo:latest",
    "No deterministic byte-for-byte seed state"
  ],
  "last_verified": "2026-09-06",
  "adapter_status": "quarantined",
  "verification": {
    "status": "blocked",
    "platforms": [],
    "evidence": []
  },
  "taxonomy": {
    "owasp": [
      "OWASP Top 10"
    ],
    "cwe": [],
    "cve": []
  },
  "references": [
    "https://github.com/OWASP/NodeGoat/blob/v1.4/docker-compose.yml",
    "https://github.com/OWASP/NodeGoat/blob/v1.4/Dockerfile"
  ]
}
