{
  "schema_version": 1,
  "id": "bwapp",
  "display_name": "bWAPP",
  "description": "Buggy Web Application training suite.",
  "categories": [
    "web",
    "php"
  ],
  "runtime_backend": "docker-engine",
  "upstream": {
    "repository": "https://sourceforge.net/p/bwapp/code/ci/master/tree/",
    "homepage": "https://www.itsecgames.com/"
  },
  "version": {
    "release": "2.2",
    "tag": "2.2",
    "commit": ""
  },
  "license": {
    "spdx": "NOASSERTION",
    "evidence_url": "https://sourceforge.net/p/bwapp/code/ci/master/tree/bWAPP/credits.php?format=raw",
    "redistribution": "The official credits reserve all rights and the SourceForge project metadata names no license; no explicit source modification or redistribution grant was found."
  },
  "trust": {
    "level": "quarantined",
    "evidence": [
      "https://sourceforge.net/p/bwapp/code/ci/master/tree/bWAPP/credits.php?format=raw",
      "https://sourceforge.net/rest/p/bwapp"
    ],
    "limitations": [
      "Provenance, containment, licensing, architecture, or functionality review is incomplete."
    ],
    "status_reason": "No maintainer-published OCI image exists and no explicit redistribution grant was found; prohibited third-party images will not be used."
  },
  "images": [],
  "services": [
    {
      "name": "web",
      "image_role": "application",
      "internal_port": 80,
      "protocol": "http",
      "health_path": "/login.php",
      "identity_marker": "bWAPP"
    },
    {
      "name": "database",
      "image_role": "database",
      "internal_port": 3306,
      "protocol": "tcp",
      "health_path": "/",
      "identity_marker": "MySQL"
    }
  ],
  "friendly_hostname": "bwapp.test",
  "health_check": {
    "type": "http-identity-and-functionality",
    "checks": [
      "Login and vulnerability catalogue would need verification"
    ],
    "timeout_seconds": 120
  },
  "initialization": {
    "automatic": false,
    "steps": [
      "Official install.php requires PHP, MySQL, and writable directories"
    ]
  },
  "reset": {
    "strategy": "Would need to discard owned database and writable application state",
    "effects": [
      "database",
      "application-writes"
    ]
  },
  "default_credentials": [
    "bee / bug"
  ],
  "resources": {
    "memory_mb": 1024,
    "cpus": 1,
    "pids": 384,
    "read_only_root": false
  },
  "ephemeral_storage": {
    "uid": 0,
    "gid": 0,
    "seeded": [],
    "empty": []
  },
  "persistence": {
    "required": true,
    "volumes": [
      "database",
      "application-writes"
    ]
  },
  "outbound_network": {
    "required": false,
    "reason": "Core training is local; external-protocol exercises require explicit contained fixtures or acknowledged egress.",
    "challenge_dependencies": [
      "RFI, SSRF, DNS, SMTP, LDAP, FTP, SNMP, WebDAV, Heartbleed, and Shellshock features need supporting services"
    ]
  },
  "dangerous_capabilities": [],
  "expected_functionality": [
    "bWAPP vulnerability catalogue"
  ],
  "known_limitations": [
    "No trusted image",
    "Official credits reserve all rights and redistribution permission is unresolved",
    "Obsolete runtime compatibility likely"
  ],
  "last_verified": "2026-09-06",
  "adapter_status": "quarantined",
  "verification": {
    "status": "blocked",
    "platforms": [],
    "evidence": []
  },
  "taxonomy": {
    "owasp": [
      "OWASP Top 10"
    ],
    "cwe": [],
    "cve": []
  },
  "references": [
    "https://sourceforge.net/p/bwapp/code/ci/master/tree/INSTALL.txt",
    "https://sourceforge.net/rest/p/bwapp"
  ]
}
